{
  "contract": "relay-proof",
  "contract_version": 2,
  "connection_id": "11111111-2222-4333-8444-555555555555",
  "app_id": "123456789012345678",
  "guild_id": "223456789012345678",
  "generation": 7,
  "key_id": "relay-current-2026-01",
  "issued_at": "2026-08-08T12:00:00Z",
  "expires_at": "2026-08-08T12:00:30Z",
  "idempotency_key": "33333333-4444-4555-8666-777777777777",
  "proof": {
    "type": "interaction",
    "interaction_id": "323456789012345678",
    "user_id": "423456789012345678",
    "command": "applications.approve"
  },
  "route": {
    "method": "POST",
    "path": "/api/v1/discord/staff/applications/opaque/approve"
  },
  "body_sha256": "e3b0c44298fc1c149afbf4c8996fb92427ae41e4649b934ca495991b7852b855",
  "signature": {
    "algorithm": "ed25519",
    "value": "6b9902af43d649ac8574f48bd971e27a9def758c66e657820d117cac439f1a03a10d3f36350aec4a18c4b904fa722903ab68205e658ca8b2896294108eccaf02"
  }
}
